,Title,Views,Date_Time,Video_Link,Thumbnail_Link
1654,Python Programming Tutorial | Count number of vowels using sets in given string | GeeksforGeeks,11K views,7 years ago,https://www.youtube.com//watch?v=LO7R3SNU6Vk,https://i.ytimg.com/vi/LO7R3SNU6Vk/hqdefault.jpg
1655,Tilt of Binary Tree | GeeksforGeeks,3.5K views,7 years ago,https://www.youtube.com//watch?v=-41E1g8NoMM,https://i.ytimg.com/vi/-41E1g8NoMM/hqdefault.jpg
1656,Python Programming Tutorial | Cyclically rotate an array by one | List Slicing | GeeksforGeeks,6.6K views,7 years ago,https://www.youtube.com//watch?v=JAvYxrtoodk,https://i.ytimg.com/vi/JAvYxrtoodk/hqdefault.jpg
1657,Check if an array represents Inorder of Binary Search tree or not | GeeksforGeeks,2.5K views,7 years ago,https://www.youtube.com//watch?v=v3ADo5kpVSE,https://i.ytimg.com/vi/v3ADo5kpVSE/hqdefault.jpg
1658,Android Development Tutorial | Saving data using Shared Preferences | GeeksforGeeks,3K views,7 years ago,https://www.youtube.com//watch?v=4mDp47rRK8M,https://i.ytimg.com/vi/4mDp47rRK8M/hqdefault.jpg
1659,Remove BST keys outside the given range | GeeksforGeeks,4.6K views,7 years ago,https://www.youtube.com//watch?v=nUvUtXryYUc,https://i.ytimg.com/vi/nUvUtXryYUc/hqdefault.jpg
1660,Smallest value in each level of Binary Tree | GeeksforGeeks,1.6K views,7 years ago,https://www.youtube.com//watch?v=mjqFCvlPdj4,https://i.ytimg.com/vi/mjqFCvlPdj4/hqdefault.jpg
1661,Reverse each word in a linked list node | GeeksforGeeks,4.4K views,7 years ago,https://www.youtube.com//watch?v=ybT1uiWQYAs,https://i.ytimg.com/vi/ybT1uiWQYAs/hqdefault.jpg
1662,Largest number less than or equal to N in BST (Iterative Approach) | GeeksforGeeks,1.2K views,7 years ago,https://www.youtube.com//watch?v=3EL8c9bBeco,https://i.ytimg.com/vi/3EL8c9bBeco/hqdefault.jpg
1663,Print alternate nodes of a linked list using recursion | GeeksforGeeks,4K views,7 years ago,https://www.youtube.com//watch?v=ksyUny54Avk&pp=0gcJCXwKAYcqIYzv,https://i.ytimg.com/vi/ksyUny54Avk/hqdefault.jpg
1664,Modify a binary tree to get preorder traversal using right pointers only | GeeksforGeeks,2.6K views,7 years ago,https://www.youtube.com//watch?v=zgmdmqNePio,https://i.ytimg.com/vi/zgmdmqNePio/hqdefault.jpg
1665,Count number of nodes having more number of children than parents in n-ary tree | GeeksforGeeks,1.8K views,7 years ago,https://www.youtube.com//watch?v=7lB1zyIbCN0,https://i.ytimg.com/vi/7lB1zyIbCN0/hqdefault.jpg
1666,"Sort a linked list of 0s, 1s and 2s by changing links | GeeksforGeeks",7.8K views,7 years ago,https://www.youtube.com//watch?v=TXRoiRMWiOE,https://i.ytimg.com/vi/TXRoiRMWiOE/hqdefault.jpg
1667,Sorted order printing of a given array that represents a BST | GeeksforGeeks,3.3K views,7 years ago,https://www.youtube.com//watch?v=Z_5OpW49Rik,https://i.ytimg.com/vi/Z_5OpW49Rik/hqdefault.jpg
1668,Print Binary Tree levels in sorted order | Set 2 (Using set) | GeeksforGeeks,1K views,7 years ago,https://www.youtube.com//watch?v=3uyoO9SSf1c,https://i.ytimg.com/vi/3uyoO9SSf1c/hqdefault.jpg
1669,Delete alternate nodes of a Linked List | GeeksforGeeks,12K views,7 years ago,https://www.youtube.com//watch?v=q5_qDnl7pSo,https://i.ytimg.com/vi/q5_qDnl7pSo/hqdefault.jpg
1670,Check if two BSTs contain same set of elements | GeeksforGeeks,3.3K views,7 years ago,https://www.youtube.com//watch?v=c-OSdbpOVDE&pp=0gcJCXwKAYcqIYzv,https://i.ytimg.com/vi/c-OSdbpOVDE/hqdefault.jpg
1671,Print the alternate nodes of linked list (Iterative Method)  | GeeksforGeeks,5.5K views,7 years ago,https://www.youtube.com//watch?v=htsTNo6n9Uc,https://i.ytimg.com/vi/htsTNo6n9Uc/hqdefault.jpg
1672,Find the node with minimum value in a Binary Search Tree | GeeksforGeeks,9.8K views,7 years ago,https://www.youtube.com//watch?v=GgDwIm1TlvE,https://i.ytimg.com/vi/GgDwIm1TlvE/hqdefault.jpg
1673,Add all greater values to every node in a given BST | GeeksforGeeks,4.8K views,7 years ago,https://www.youtube.com//watch?v=7Y6bZrwWz5s,https://i.ytimg.com/vi/7Y6bZrwWz5s/hqdefault.jpg
1674,Largest value in each level of Binary Tree | Set-2 (Iterative Approach) | GeeksforGeeks,1.7K views,7 years ago,https://www.youtube.com//watch?v=aEbbnqPaAZI,https://i.ytimg.com/vi/aEbbnqPaAZI/hqdefault.jpg
1675,Find n-th node of inorder traversal | GeeksforGeeks,4.2K views,7 years ago,https://www.youtube.com//watch?v=nMRTfhTkxC4,https://i.ytimg.com/vi/nMRTfhTkxC4/hqdefault.jpg
1676,Find a pair with given sum in BST | GeeksforGeeks,10K views,7 years ago,https://www.youtube.com//watch?v=TvAFvAoS6s8,https://i.ytimg.com/vi/TvAFvAoS6s8/hqdefault.jpg
1677,Python Programming Tutorial | Program to split and join a string | GeeksforGeeks,7.6K views,7 years ago,https://www.youtube.com//watch?v=aWab32mDz9Y,https://i.ytimg.com/vi/aWab32mDz9Y/hqdefault.jpg
1678,Find sum of all right leaves in a given Binary Tree | GeeksforGeeks,1.8K views,7 years ago,https://www.youtube.com//watch?v=2LGcEh_EVqo,https://i.ytimg.com/vi/2LGcEh_EVqo/hqdefault.jpg
1679,Sort linked list which is already sorted on absolute values | GeeksforGeeks,6.9K views,7 years ago,https://www.youtube.com//watch?v=hH4XI0INmNg,https://i.ytimg.com/vi/hH4XI0INmNg/hqdefault.jpg
1680,Python Programming Tutorial | Program for removing i-th character from a string | GeeksforGeeks,6.4K views,7 years ago,https://www.youtube.com//watch?v=baoPgsuTYsU&pp=0gcJCXwKAYcqIYzv,https://i.ytimg.com/vi/baoPgsuTYsU/hqdefault.jpg
1681,Minimum flips of continuous characters to make all same in a binary string | GeeksforGeeks,3.3K views,7 years ago,https://www.youtube.com//watch?v=ZYqT5pDnQt8,https://i.ytimg.com/vi/ZYqT5pDnQt8/hqdefault.jpg
1682,Find the length of loop in linked list | GeeksforGeeks,16K views,7 years ago,https://www.youtube.com//watch?v=n6AMo1qFPlA,https://i.ytimg.com/vi/n6AMo1qFPlA/hqdefault.jpg
1683,Python Programming Tutorial | Find the most occurring character and its count | GeeksforGeeks,12K views,7 years ago,https://www.youtube.com//watch?v=SHo88PF-TeY,https://i.ytimg.com/vi/SHo88PF-TeY/hqdefault.jpg
1684,Add two binary strings | GeeksforGeeks,40K views,7 years ago,https://www.youtube.com//watch?v=TraAvM7JxL4&pp=0gcJCXwKAYcqIYzv,https://i.ytimg.com/vi/TraAvM7JxL4/hqdefault.jpg
1685,Get level of a node in binary tree | Iterative approach | GeeksforGeeks,2.2K views,7 years ago,https://www.youtube.com//watch?v=MHiHfW4iPlk,https://i.ytimg.com/vi/MHiHfW4iPlk/hqdefault.jpg
1686,Deepest right leaf node in a binary tree | Iterative approach | GeeksforGeeks,1.2K views,7 years ago,https://www.youtube.com//watch?v=vNVXeMgZ75U,https://i.ytimg.com/vi/vNVXeMgZ75U/hqdefault.jpg
1687,Python Programming Tutorial | Find duplicates in a string using Counter method | GeeksforGeeks,20K views,7 years ago,https://www.youtube.com//watch?v=Z8Zc84SoXiY&pp=0gcJCXwKAYcqIYzv,https://i.ytimg.com/vi/Z8Zc84SoXiY/hqdefault.jpg
1688,Count ways to remove one element from a binary string so that XOR becomes zero | GeeksforGeeks,1.6K views,7 years ago,https://www.youtube.com//watch?v=qo5EKwGLFzY,https://i.ytimg.com/vi/qo5EKwGLFzY/hqdefault.jpg
1689,Print Levels of all nodes in a Binary Tree | GeeksforGeeks,6.9K views,7 years ago,https://www.youtube.com//watch?v=yXbkd0MJZfw,https://i.ytimg.com/vi/yXbkd0MJZfw/hqdefault.jpg
1690,Find sum of all left leaves in a given Binary Tree | GeeksforGeeks,4.9K views,7 years ago,https://www.youtube.com//watch?v=d9g493VwC7s,https://i.ytimg.com/vi/d9g493VwC7s/hqdefault.jpg
1691,Convert singly linked list into circular linked list | GeeksforGeeks,8.1K views,7 years ago,https://www.youtube.com//watch?v=hLz1HXsuyvw,https://i.ytimg.com/vi/hLz1HXsuyvw/hqdefault.jpg
1692,Print BST keys in the given range | GeeksforGeeks,8K views,7 years ago,https://www.youtube.com//watch?v=k6oqiFZOACA,https://i.ytimg.com/vi/k6oqiFZOACA/hqdefault.jpg
1693,Count Non-Leaf nodes in a Binary Tree | GeeksforGeeks,8K views,7 years ago,https://www.youtube.com//watch?v=zdAz4duTaE0,https://i.ytimg.com/vi/zdAz4duTaE0/hqdefault.jpg
1694,Inorder Successor in Binary Search Tree | GeeksforGeeks,32K views,7 years ago,https://www.youtube.com//watch?v=kr3BOCNEYHI,https://i.ytimg.com/vi/kr3BOCNEYHI/hqdefault.jpg
1695,First non-repeating integer in a linked list | GeeksforGeeks,2.9K views,7 years ago,https://www.youtube.com//watch?v=lnA26dsi3IU&pp=0gcJCXwKAYcqIYzv,https://i.ytimg.com/vi/lnA26dsi3IU/hqdefault.jpg
1696,Python Programming Tutorial | Partial Functions in Python | GeeksforGeeks,7.4K views,7 years ago,https://www.youtube.com//watch?v=rI8gqpHOyw8,https://i.ytimg.com/vi/rI8gqpHOyw8/hqdefault.jpg
1697,Iterative diagonal traversal of binary tree | GeeksforGeeks,5.3K views,7 years ago,https://www.youtube.com//watch?v=vd6Ly5rGBo0,https://i.ytimg.com/vi/vd6Ly5rGBo0/hqdefault.jpg
1698,Transform a BST to greater sum tree | GeeksforGeeks,5.6K views,7 years ago,https://www.youtube.com//watch?v=hx8IADDBqb0,https://i.ytimg.com/vi/hx8IADDBqb0/hqdefault.jpg
1699,Print all leaf nodes of a Binary Tree from left to right | GeeksforGeeks,9.3K views,7 years ago,https://www.youtube.com//watch?v=rBekvLt23wY,https://i.ytimg.com/vi/rBekvLt23wY/hqdefault.jpg
1700,Height of binary tree considering even level leaves only | GeeksforGeeks,1.1K views,7 years ago,https://www.youtube.com//watch?v=WpbCv5XoP9U,https://i.ytimg.com/vi/WpbCv5XoP9U/hqdefault.jpg
1701,Python Programming Tutorial | Class or Static Variables in Python | GeeksforGeeks,10K views,7 years ago,https://www.youtube.com//watch?v=FlGiKthOFbU&pp=0gcJCXwKAYcqIYzv,https://i.ytimg.com/vi/FlGiKthOFbU/hqdefault.jpg
1702,Python Programming Tutorial | Global and Local Variables in Python | GeeksforGeeks,4.8K views,7 years ago,https://www.youtube.com//watch?v=SH_PDn1FG9I,https://i.ytimg.com/vi/SH_PDn1FG9I/hqdefault.jpg
1703,Python Programming Tutorial | Method Overloading | GeeksforGeeks,18K views,7 years ago,https://www.youtube.com//watch?v=jMQfA1cmFw8,https://i.ytimg.com/vi/jMQfA1cmFw8/hqdefault.jpg
1704,Product of nodes at k-th level in a tree represented as string | GeeksforGeeks,1K views,7 years ago,https://www.youtube.com//watch?v=Y-yARmXlSbQ,https://i.ytimg.com/vi/Y-yARmXlSbQ/hqdefault.jpg
1705,Largest value in each level of Binary Tree | GeeksforGeeks,3.8K views,7 years ago,https://www.youtube.com//watch?v=XYunn1WnTXw,https://i.ytimg.com/vi/XYunn1WnTXw/hqdefault.jpg
1706,Iterative searching in Binary Search Tree | GeeksforGeeks,5.7K views,7 years ago,https://www.youtube.com//watch?v=Re-HdpXo1is,https://i.ytimg.com/vi/Re-HdpXo1is/hqdefault.jpg
1707,Deepest left leaf node in a binary tree | Iterative approach | GeeksforGeeks,1.8K views,7 years ago,https://www.youtube.com//watch?v=cNBNjZwnPaU&pp=0gcJCXwKAYcqIYzv,https://i.ytimg.com/vi/cNBNjZwnPaU/hqdefault.jpg
1708,Count BST nodes that lie in a given range | GeeksforGeeks,4.5K views,7 years ago,https://www.youtube.com//watch?v=jfk-uX_xKK4,https://i.ytimg.com/vi/jfk-uX_xKK4/hqdefault.jpg
1709,Print the nodes at odd levels of a tree | GeeksforGeeks,2.2K views,7 years ago,https://www.youtube.com//watch?v=38Sm_29KJ3E,https://i.ytimg.com/vi/38Sm_29KJ3E/hqdefault.jpg
1710,Check if a Binary Tree (not BST) has duplicate values | GeeksforGeeks,7.8K views,7 years ago,https://www.youtube.com//watch?v=UdhMwtIcw6w,https://i.ytimg.com/vi/UdhMwtIcw6w/hqdefault.jpg
1711,Check if a string follows a^nb^n pattern or not | GeeksforGeeks,2.7K views,7 years ago,https://www.youtube.com//watch?v=ydmOFg2HLmc,https://i.ytimg.com/vi/ydmOFg2HLmc/hqdefault.jpg
1712,Recursive function to delete k-th node from linked list | GeeksforGeeks,9.4K views,7 years ago,https://www.youtube.com//watch?v=EWkox1WR4VU,https://i.ytimg.com/vi/EWkox1WR4VU/hqdefault.jpg
1713,Longest common subsequence with permutations allowed | GeeksforGeeks,1.8K views,7 years ago,https://www.youtube.com//watch?v=2nQXdTb9rus,https://i.ytimg.com/vi/2nQXdTb9rus/hqdefault.jpg
1714,Sum of all leaf nodes of binary tree | GeeksforGeeks,6.7K views,7 years ago,https://www.youtube.com//watch?v=0bYyrgFUvkc,https://i.ytimg.com/vi/0bYyrgFUvkc/hqdefault.jpg
1715,Print Binary Tree levels in sorted order | GeeksforGeeks,4K views,7 years ago,https://www.youtube.com//watch?v=TEDXYAdZOEw,https://i.ytimg.com/vi/TEDXYAdZOEw/hqdefault.jpg
1716,Level order traversal line by line | Set 3 (Using One Queue) | GeeksforGeeks,4.5K views,7 years ago,https://www.youtube.com//watch?v=xUnTwzF7TMg,https://i.ytimg.com/vi/xUnTwzF7TMg/hqdefault.jpg
1717,Right view of Binary Tree using Queue | GeeksforGeeks,5.5K views,7 years ago,https://www.youtube.com//watch?v=RUezU6R4JVI,https://i.ytimg.com/vi/RUezU6R4JVI/hqdefault.jpg
1718,Print nodes at k distance from root iteratively | GeeksforGeeks,4.4K views,7 years ago,https://www.youtube.com//watch?v=W6jRQRTEVkQ,https://i.ytimg.com/vi/W6jRQRTEVkQ/hqdefault.jpg
1719,Top three elements in binary tree | GeeksforGeeks,1K views,7 years ago,https://www.youtube.com//watch?v=pd-5b_lXZzQ,https://i.ytimg.com/vi/pd-5b_lXZzQ/hqdefault.jpg
1720,C Program to Sort an array of names or strings | GeeksforGeeks,7K views,7 years ago,https://www.youtube.com//watch?v=hQVPg-I5SDU,https://i.ytimg.com/vi/hQVPg-I5SDU/hqdefault.jpg
1721,Print Concatenation of Zig-Zag String in ‘n’ Rows | GeeksforGeeks,13K views,7 years ago,https://www.youtube.com//watch?v=LhacuzXRVKI,https://i.ytimg.com/vi/LhacuzXRVKI/hqdefault.jpg
1722,"Given two strings, find if first string is a subsequence of second | GeeksforGeeks",14K views,7 years ago,https://www.youtube.com//watch?v=88bzWJnIepI,https://i.ytimg.com/vi/88bzWJnIepI/hqdefault.jpg
1723,A Program to check if strings are rotations of each other or not | GeeksforGeeks,15K views,7 years ago,https://www.youtube.com//watch?v=-xX8WHd7Ztk,https://i.ytimg.com/vi/-xX8WHd7Ztk/hqdefault.jpg
1724,Remove recurring digits in a given number | GeeksforGeeks,4K views,7 years ago,https://www.youtube.com//watch?v=mA5wr74Lbao,https://i.ytimg.com/vi/mA5wr74Lbao/hqdefault.jpg
1725,Maximum length prefix of one string that occurs as subsequence in another | GeeksforGeeks,2.5K views,7 years ago,https://www.youtube.com//watch?v=PKtKEKsCcKk,https://i.ytimg.com/vi/PKtKEKsCcKk/hqdefault.jpg
1726,Minimum number of palindromic subsequences to be removed to empty a binary string | GeeksforGeeks,2.8K views,7 years ago,https://www.youtube.com//watch?v=oXB_WwL1EP4,https://i.ytimg.com/vi/oXB_WwL1EP4/hqdefault.jpg
1727,Convert a sentence into its equivalent mobile numeric keypad sequence | GeeksforGeeks,6K views,7 years ago,https://www.youtube.com//watch?v=hE4Nn7o4GFw,https://i.ytimg.com/vi/hE4Nn7o4GFw/hqdefault.jpg
1728,Largest number that is not a perfect square | GeeksforGeeks,3.9K views,7 years ago,https://www.youtube.com//watch?v=WRh6MmQLnpk&pp=0gcJCXwKAYcqIYzv,https://i.ytimg.com/vi/WRh6MmQLnpk/hqdefault.jpg
1729,Longest subsequence where each character occurs at least k times | GeeksforGeeks,4.7K views,7 years ago,https://www.youtube.com//watch?v=pSjFRi_v8iY,https://i.ytimg.com/vi/pSjFRi_v8iY/hqdefault.jpg
1730,Find the number of contiguous subsequences which recursively add up to 9 | GeeksforGeeks,2K views,7 years ago,https://www.youtube.com//watch?v=tbMEj5VWShg,https://i.ytimg.com/vi/tbMEj5VWShg/hqdefault.jpg
1731,Find final value if we double after every successful search in array | GeeksforGeeks,4.3K views,7 years ago,https://www.youtube.com//watch?v=CPTbMozK2jA,https://i.ytimg.com/vi/CPTbMozK2jA/hqdefault.jpg
1732,Check whether a binary tree is a full binary tree or not | Iterative Approach | GeeksforGeeks,1.5K views,7 years ago,https://www.youtube.com//watch?v=V2Hpy1cCD5I,https://i.ytimg.com/vi/V2Hpy1cCD5I/hqdefault.jpg
1733,Iterative program to Calculate Size of a tree | GeeksforGeeks,1.4K views,7 years ago,https://www.youtube.com//watch?v=0gPDf0n4A2M,https://i.ytimg.com/vi/0gPDf0n4A2M/hqdefault.jpg
1734,Remove all leaf nodes from the binary search tree | GeeksforGeeks,7.4K views,7 years ago,https://www.youtube.com//watch?v=1gW-fL6-vHE,https://i.ytimg.com/vi/1gW-fL6-vHE/hqdefault.jpg
1735,Second largest element in BST | GeeksforGeeks,8.5K views,7 years ago,https://www.youtube.com//watch?v=OKAEDMCwhNI,https://i.ytimg.com/vi/OKAEDMCwhNI/hqdefault.jpg
1736,Lexicographical concatenation of all substrings of a string | GeeksforGeeks,4K views,7 years ago,https://www.youtube.com//watch?v=iUkj6mKrKSw,https://i.ytimg.com/vi/iUkj6mKrKSw/hqdefault.jpg
1737,Android Development Tutorial | Working with RecyclerView in Android | GeeksforGeeks,3.6K views,7 years ago,https://www.youtube.com//watch?v=wNY5wdwqR_U,https://i.ytimg.com/vi/wNY5wdwqR_U/hqdefault.jpg
1738,Convert the string into palindrome string by changing only one character | GeeksforGeeks,8.7K views,7 years ago,https://www.youtube.com//watch?v=0h7eK2NUKow,https://i.ytimg.com/vi/0h7eK2NUKow/hqdefault.jpg
1739,Recursive Implementation of atoi() | GeeksforGeeks,12K views,7 years ago,https://www.youtube.com//watch?v=cXf7NKgT13s,https://i.ytimg.com/vi/cXf7NKgT13s/hqdefault.jpg
1740,String from prefix and suffix of given two strings | GeeksforGeeks,7.8K views,7 years ago,https://www.youtube.com//watch?v=6PMRRgQ5WWQ,https://i.ytimg.com/vi/6PMRRgQ5WWQ/hqdefault.jpg
1741,Print string of odd length in ‘X’ format | GeeksforGeeks,4K views,7 years ago,https://www.youtube.com//watch?v=7gyjMrezEos,https://i.ytimg.com/vi/7gyjMrezEos/hqdefault.jpg
1742,Find an array element such that all elements are divisible by it | GeeksforGeeks,6.4K views,7 years ago,https://www.youtube.com//watch?v=RglGlzkliNM,https://i.ytimg.com/vi/RglGlzkliNM/hqdefault.jpg
1743,Delete a node whose pointer/reference is given in a singly linked list | GeeksforGeeks,9.8K views,7 years ago,https://www.youtube.com//watch?v=yOjQS7rdkQQ,https://i.ytimg.com/vi/yOjQS7rdkQQ/hqdefault.jpg
1744,Java Programming Tutorial | Data Types in Java | GeeksforGeeks,17K views,7 years ago,https://www.youtube.com//watch?v=dY2LQcE-Qvc,https://i.ytimg.com/vi/dY2LQcE-Qvc/hqdefault.jpg
1745,Rotate a Linked List | GeeksforGeeks,22K views,7 years ago,https://www.youtube.com//watch?v=tWtq2nd7sI4,https://i.ytimg.com/vi/tWtq2nd7sI4/hqdefault.jpg
1746,Multiply two numbers represented by Linked Lists | GeeksforGeeks,21K views,7 years ago,https://www.youtube.com//watch?v=XVm27KGy4Fw,https://i.ytimg.com/vi/XVm27KGy4Fw/hqdefault.jpg
1747,Does JVM create object of Main class? | GeeksforGeeks,10K views,7 years ago,https://www.youtube.com//watch?v=bRC0Yud2D38,https://i.ytimg.com/vi/bRC0Yud2D38/hqdefault.jpg
1748,Java Identifiers | GeeksforGeeks,27K views,7 years ago,https://www.youtube.com//watch?v=_mOz0GOG3uk,https://i.ytimg.com/vi/_mOz0GOG3uk/hqdefault.jpg
1749,Myth about the file name and class name in Java | GeeksforGeeks,22K views,7 years ago,https://www.youtube.com//watch?v=2q_LoVmev7g,https://i.ytimg.com/vi/2q_LoVmev7g/hqdefault.jpg
1750,Is main method compulsory in Java? | GeeksforGeeks,22K views,7 years ago,https://www.youtube.com//watch?v=KXkz1gu6dxQ,https://i.ytimg.com/vi/KXkz1gu6dxQ/hqdefault.jpg
1751,Beginning Java programming with Hello World Example | GeeksforGeeks,90K views,7 years ago,https://www.youtube.com//watch?v=lcJzw0JGfeE,https://i.ytimg.com/vi/lcJzw0JGfeE/hqdefault.jpg
1752,Python Programming Tutorial | Remove all duplicates words from a given sentence | GeeksforGeeks,8.9K views,7 years ago,https://www.youtube.com//watch?v=tTjBhgJ-NDE,https://i.ytimg.com/vi/tTjBhgJ-NDE/hqdefault.jpg
1753,Check if two strings are k-anagrams or not | GeeksforGeeks,6.3K views,7 years ago,https://www.youtube.com//watch?v=g6OvIvyDy-w,https://i.ytimg.com/vi/g6OvIvyDy-w/hqdefault.jpg
1754,"Count words whose i-th letter is either (i-1)-th, i-th, or (i+1)-th letter of a word | GeeksforGeeks",1.5K views,7 years ago,https://www.youtube.com//watch?v=_qd9nBkLvNA,https://i.ytimg.com/vi/_qd9nBkLvNA/hqdefault.jpg
1755,Remove minimum number of characters so that two strings become anagram | GeeksforGeeks,14K views,7 years ago,https://www.youtube.com//watch?v=JCMBOZg83Nk,https://i.ytimg.com/vi/JCMBOZg83Nk/hqdefault.jpg
1756,Print the string after the specified character has occurred given no. of times | GeeksforGeeks,3.9K views,7 years ago,https://www.youtube.com//watch?v=v3vPtLKr9s4,https://i.ytimg.com/vi/v3vPtLKr9s4/hqdefault.jpg
1757,Number of distinct permutation a String can have | GeeksforGeeks,7.2K views,7 years ago,https://www.youtube.com//watch?v=jBL2TIZ0dhc,https://i.ytimg.com/vi/jBL2TIZ0dhc/hqdefault.jpg
1758,Remove characters from the first string which are present in the second string | GeeksforGeeks,12K views,7 years ago,https://www.youtube.com//watch?v=qRgmO__1VlQ,https://i.ytimg.com/vi/qRgmO__1VlQ/hqdefault.jpg
1759,Print common characters of two Strings in alphabetical order | GeeksforGeeks,17K views,7 years ago,https://www.youtube.com//watch?v=7-qAlL8Wz7w,https://i.ytimg.com/vi/7-qAlL8Wz7w/hqdefault.jpg
1760,Count words that appear exactly two times in an array of words | GeeksforGeeks,2.9K views,7 years ago,https://www.youtube.com//watch?v=Ast7ctj1pqA,https://i.ytimg.com/vi/Ast7ctj1pqA/hqdefault.jpg
1761,Number of even substrings in a string of digits | GeeksforGeeks,3.3K views,7 years ago,https://www.youtube.com//watch?v=Ow4XcYWOYy4,https://i.ytimg.com/vi/Ow4XcYWOYy4/hqdefault.jpg
1762,Check if frequency of all characters can become same by one removal | GeeksforGeeks,5.2K views,7 years ago,https://www.youtube.com//watch?v=unw9XO7vUYQ,https://i.ytimg.com/vi/unw9XO7vUYQ/hqdefault.jpg
1763,Group words with same set of characters | GeeksforGeeks,3.2K views,7 years ago,https://www.youtube.com//watch?v=TlDOEDODFfc,https://i.ytimg.com/vi/TlDOEDODFfc/hqdefault.jpg
1764,Identical Linked Lists | GeeksforGeeks,4.2K views,7 years ago,https://www.youtube.com//watch?v=E8V0mFt4KBA,https://i.ytimg.com/vi/E8V0mFt4KBA/hqdefault.jpg
1765,Make a loop at k-th position in a linked list | GeeksforGeeks,4.2K views,7 years ago,https://www.youtube.com//watch?v=ZgeHNHo2RAM,https://i.ytimg.com/vi/ZgeHNHo2RAM/hqdefault.jpg
1766,Delete a linked list using recursion | GeeksforGeeks,9.3K views,7 years ago,https://www.youtube.com//watch?v=4fyh_ddRyRE,https://i.ytimg.com/vi/4fyh_ddRyRE/hqdefault.jpg
1767,Android Development Tutorial | The Activity Lifecycle | GeeksforGeeks,3.2K views,7 years ago,https://www.youtube.com//watch?v=Tj4KdVulI_E,https://i.ytimg.com/vi/Tj4KdVulI_E/hqdefault.jpg
1768,Reverse a string in C/C++ | GeeksforGeeks,53K views,7 years ago,https://www.youtube.com//watch?v=L44_gKvPZ34,https://i.ytimg.com/vi/L44_gKvPZ34/hqdefault.jpg
1769,C++ Programming Language Tutorial | Map in C++ STL | GeeksforGeeks,95K views,7 years ago,https://www.youtube.com//watch?v=kDwXAmLz47w,https://i.ytimg.com/vi/kDwXAmLz47w/hqdefault.jpg
1770,C++ Programming Language Tutorial | Multiset in C++ STL | GeeksforGeeks,16K views,7 years ago,https://www.youtube.com//watch?v=xelzlR_OGnI&pp=0gcJCXwKAYcqIYzv,https://i.ytimg.com/vi/xelzlR_OGnI/hqdefault.jpg
1771,Delete leaf nodes with value as x | GeeksforGeeks,5.4K views,8 years ago,https://www.youtube.com//watch?v=qasFZ118RTk,https://i.ytimg.com/vi/qasFZ118RTk/hqdefault.jpg
1772,Check if a linked list of strings forms a palindrome | GeeksforGeeks,20K views,8 years ago,https://www.youtube.com//watch?v=Ga9iLtMKhKo,https://i.ytimg.com/vi/Ga9iLtMKhKo/hqdefault.jpg
1773,Remove every k-th node of the linked list | GeeksforGeeks,5.6K views,8 years ago,https://www.youtube.com//watch?v=o-_r86WD3Qo,https://i.ytimg.com/vi/o-_r86WD3Qo/hqdefault.jpg
1774,Pairwise swap elements of a given linked list | GeeksforGeeks,16K views,8 years ago,https://www.youtube.com//watch?v=bN8nk4ZXzK0,https://i.ytimg.com/vi/bN8nk4ZXzK0/hqdefault.jpg
1775,Print all the duplicates in the input string | GeeksforGeeks,10K views,8 years ago,https://www.youtube.com//watch?v=KYVR5U7rwAE,https://i.ytimg.com/vi/KYVR5U7rwAE/hqdefault.jpg
1776,Divide a string in N equal parts | GeeksforGeeks,7.9K views,8 years ago,https://www.youtube.com//watch?v=O7GdshOYljE,https://i.ytimg.com/vi/O7GdshOYljE/hqdefault.jpg
1777,Count words in a given string | GeeksforGeeks,8.3K views,8 years ago,https://www.youtube.com//watch?v=8HY6HTXjYU8,https://i.ytimg.com/vi/8HY6HTXjYU8/hqdefault.jpg
1778,Count number of substrings with exactly k distinct characters | GeeksforGeeks,53K views,8 years ago,https://www.youtube.com//watch?v=XKzagsqVtf8,https://i.ytimg.com/vi/XKzagsqVtf8/hqdefault.jpg
1779,Find k’th character of decrypted string | GeeksforGeeks,6.4K views,8 years ago,https://www.youtube.com//watch?v=OrU84a6cdGI&pp=0gcJCXwKAYcqIYzv,https://i.ytimg.com/vi/OrU84a6cdGI/hqdefault.jpg
1780,Android Development Tutorial | Passing data b/w Activities by Intent Basic Example | GeeksforGeeks,2.2K views,8 years ago,https://www.youtube.com//watch?v=LCMOVfIWFYQ,https://i.ytimg.com/vi/LCMOVfIWFYQ/hqdefault.jpg
1781,Count characters at same position as in English alphabet | GeeksforGeeks,2.4K views,8 years ago,https://www.youtube.com//watch?v=MhLeyMLKE3w,https://i.ytimg.com/vi/MhLeyMLKE3w/hqdefault.jpg
1782,Find second most frequent character in a string | GeeksforGeeks,23K views,8 years ago,https://www.youtube.com//watch?v=KK5M4GLsuAg,https://i.ytimg.com/vi/KK5M4GLsuAg/hqdefault.jpg
1783,C++ Programming Language Tutorial | Pair in C++ STL | GeeksforGeeks,32K views,8 years ago,https://www.youtube.com//watch?v=4LG1H3x6-BQ,https://i.ytimg.com/vi/4LG1H3x6-BQ/hqdefault.jpg
1784,C++ Programming Language Tutorial | List in C++ STL | GeeksforGeeks,32K views,8 years ago,https://www.youtube.com//watch?v=VcCRXrLFxyc,https://i.ytimg.com/vi/VcCRXrLFxyc/hqdefault.jpg
1785,Dial’s Algorithm (Optimized Dijkstra for small range weights) | GeeksforGeeks,29K views,8 years ago,https://www.youtube.com//watch?v=PwJwc5oj8cw,https://i.ytimg.com/vi/PwJwc5oj8cw/hqdefault.jpg
1786,C++ Programming Language Tutorial | Set in C++ STL | GeeksforGeeks,62K views,8 years ago,https://www.youtube.com//watch?v=YuZPHhniZtw,https://i.ytimg.com/vi/YuZPHhniZtw/hqdefault.jpg
1787,Count rotations in sorted and rotated linked list | GeeksforGeeks,2.7K views,8 years ago,https://www.youtube.com//watch?v=sqdrHv4Yw6c,https://i.ytimg.com/vi/sqdrHv4Yw6c/hqdefault.jpg
